{
  "schema_version": "1.0",
  "id": "ptr-chase-sm8650-x4-tlb-thp-madvise",
  "title": "SM8650 X4 TLB Phase D THP cohort -T 侧（512/2304/3072KiB × 4 order_seed，THP 请求）",
  "protocol_version": "1.2",
  "harness": "portable",
  "parameters": [
    { "name": "buffer", "type": "size", "range": "512KiB..3072KiB，策略负控点 + 两个历史 mixed 映射机会点" },
    { "name": "stride", "type": "size", "default": "64B" },
    { "name": "warmup_passes", "type": "int", "default": 2 },
    { "name": "loads_per_slot", "type": "int", "default": 8 },
    { "name": "min_loads", "type": "int", "default": 4096 },
    { "name": "repetitions", "type": "int", "default": 10 },
    { "name": "thp", "type": "int", "default": 1 },
    { "name": "seed", "type": "int", "default": 42 },
    {
      "name": "pmu_events",
      "type": "pmu-event-list",
      "default": [
        { "name": "cycles", "type": 8, "config": "0x11" },
        { "name": "mem_access_rd", "type": 8, "config": "0x66" },
        { "name": "l1d_tlb_refill", "type": 8, "config": "0x05" },
        { "name": "dtlb_walk", "type": 8, "config": "0x34" }
      ]
    }
  ],
  "preconditions": [
    "redmi-k70pro-01 controlled-baseline profile 前后门禁通过",
    "CPU7 Cortex-X4；四个 core PMU event 同窗且 time_running == time_enabled（拒绝复用）",
    "每个 repetition 为新进程/新匿名映射；逐样本按 actual backing 分组（base/mixed/thp 不混并）；逐样本 seed 入档"
  ],
  "metrics": [
    { "name": "latency_ns", "unit": "ns", "statistic": "median" },
    { "name": "pmu.cycles.count", "unit": "events", "statistic": "median" },
    { "name": "pmu.mem_access_rd.count", "unit": "events", "statistic": "median" },
    { "name": "pmu.l1d_tlb_refill.count", "unit": "events", "statistic": "median" },
    { "name": "pmu.dtlb_walk.count", "unit": "events", "statistic": "median" }
  ],
  "execution": {
    "probe": "ptr_chase",
    "controls": ["x4-prime"],
    "params": { "repetitions": 10 },
    "sweep": {
      "buffer": ["512KiB", "2304KiB", "3072KiB"],
      "seed": [42, 7, 1337, 20260928]
    },
    "fixed_params": [
      "stride", "warmup_passes", "loads_per_slot", "min_loads",
      "thp", "pmu_events"
    ]
  },
  "notes": "§7 Phase D Q4 THP cohort 对照 -T 侧（M5/S5；计划 docs/superpowers/plans/2026-09-28-sm8650-tlb-hierarchy.md）：与 ptr-chase-sm8650-x4-tlb-thp-base 同选点同 seed（512KiB 策略负控点 + 2304/3072KiB 映射机会点 × 4 order_seed × 短训练 × G0 = 12 case）；仅请求 THP（madvise），不设 base_pages（adapter 侧两者互斥）。实际 backing 由探针双端点审计逐样本判定（base/mixed/thp 不混并）；停止预算每（buffer × policy）最多 40 进程次；必报转化表：请求次数 → 实际 backing 构成 → 端点 drift 失败数 → 进入分析样本数（选择偏差披露）。"
}
