{
  "schema_version": "1.0",
  "id": "ptr-chase-sm8650-x4-tlb-ctrl-g4",
  "title": "SM8650 X4 TLB Gate 1 正控③ 页尺寸事件 base 侧（0x8138/0x813a，锚点+映射机会点）",
  "protocol_version": "1.2",
  "harness": "portable",
  "parameters": [
    { "name": "buffer", "type": "size", "range": "512KiB..16MiB，floor/scale 锚点 + 2304/3072KiB 历史 mixed 映射机会点" },
    { "name": "stride", "type": "size", "default": "64B" },
    { "name": "warmup_passes", "type": "int", "default": 2 },
    { "name": "loads_per_slot", "type": "int", "default": 8 },
    { "name": "min_loads", "type": "int", "default": 4096 },
    { "name": "repetitions", "type": "int", "default": 10 },
    { "name": "base_pages", "type": "int", "default": 1 },
    { "name": "seed", "type": "int", "default": 42 },
    {
      "name": "pmu_events",
      "type": "pmu-event-list",
      "default": [
        { "name": "cycles", "type": 8, "config": "0x11" },
        { "name": "l1d_tlb_refill", "type": 8, "config": "0x05" },
        { "name": "dtlb_walk", "type": 8, "config": "0x34" },
        { "name": "dtlb_walk_large", "type": 8, "config": "0x8138" },
        { "name": "dtlb_walk_small", "type": 8, "config": "0x813a" }
      ]
    }
  ],
  "preconditions": [
    "redmi-k70pro-01 controlled-baseline profile 前后门禁通过",
    "CPU7 Cortex-X4；五个 core PMU event 同窗且 time_running == time_enabled（拒绝复用）",
    "每个 repetition 为新进程/新匿名映射；actual backing 必须为 base；逐样本 seed 入档"
  ],
  "metrics": [
    { "name": "latency_ns", "unit": "ns", "statistic": "median" },
    { "name": "pmu.cycles.count", "unit": "events", "statistic": "median" },
    { "name": "pmu.l1d_tlb_refill.count", "unit": "events", "statistic": "median" },
    { "name": "pmu.dtlb_walk.count", "unit": "events", "statistic": "median" },
    { "name": "pmu.dtlb_walk_large.count", "unit": "events", "statistic": "median" },
    { "name": "pmu.dtlb_walk_small.count", "unit": "events", "statistic": "median" }
  ],
  "execution": {
    "probe": "ptr_chase",
    "controls": ["x4-prime"],
    "params": { "repetitions": 10 },
    "sweep": {
      "buffer": ["512KiB", "16MiB", "2304KiB", "3072KiB"]
    },
    "fixed_params": [
      "stride", "warmup_passes", "loads_per_slot", "min_loads",
      "base_pages", "seed", "pmu_events"
    ]
  },
  "notes": "Gate 1 步骤③：0x8138/0x813a 方向性正控 base 侧（计划 docs/superpowers/plans/2026-09-28-sm8650-tlb-hierarchy.md，任务书 §5.1/§5.2 G4 组）：cycles + 0x05 + 0x34 + CANDIDATE 事件 dtlb_walk_large(0x8138)/dtlb_walk_small(0x813a)（name 按 §3.1 表 TRM 名小写落仓内惯例）。512KiB/16MiB 为 floor/scale 锚点，2304KiB/3072KiB 为映射机会点的 base 侧（-B）；§5.1 要求该组必须有 base/mixed/thp 实际 backing 对照，-T 侧由 ptr-chase-sm8650-x4-tlb-ctrl-g4-thp 承担（独立配置避免 thp 叉到锚点上）。seed 固定 42 不 sweep。"
}
